{
  "document_id": "CIRCULAR_161_2018",
  "concept_catalog_version": "global=0.1.0",
  "generated_at": "2026-07-13T10:35:28.442149+00:00",
  "coverage": {
    "total": 11,
    "mapped": 3,
    "unmapped": 8,
    "coverage_pct": 27.3,
    "review_required": 11,
    "suggested": 0
  },
  "objects": [
    {
      "clause_id": "clause_10__2",
      "clause_no": "10",
      "source_concept": "Section/Article reference",
      "canonical_id": null,
      "canonical_label": null,
      "domain": "Other",
      "action": "OTHER",
      "obligation_type": "Other",
      "mandatory_flag": "Not Applicable",
      "match_type": "unmapped",
      "match_confidence": 0.0,
      "review_required": true,
      "suggested_canonical_id": null,
      "suggested_label": null,
      "suggestion_confidence": null
    },
    {
      "clause_id": "clause_11__3",
      "clause_no": "11",
      "source_concept": "Regulation title",
      "canonical_id": "CPT_DOCUMENT_META",
      "canonical_label": "Document Metadata",
      "domain": "Other",
      "action": "OTHER",
      "obligation_type": "Other",
      "mandatory_flag": "Not Applicable",
      "match_type": "fuzzy",
      "match_confidence": 0.732,
      "review_required": true,
      "suggested_canonical_id": null,
      "suggested_label": null,
      "suggestion_confidence": null
    },
    {
      "clause_id": "clause_1",
      "clause_no": "1",
      "source_concept": "Financial stability role",
      "canonical_id": null,
      "canonical_label": null,
      "domain": "Banking Regulation & Supervision",
      "action": "OTHER",
      "obligation_type": "Other",
      "mandatory_flag": "Not Applicable",
      "match_type": "unmapped",
      "match_confidence": 0.0,
      "review_required": true,
      "suggested_canonical_id": null,
      "suggested_label": null,
      "suggestion_confidence": null
    },
    {
      "clause_id": "clause_2",
      "clause_no": "2",
      "source_concept": "Bank definition reference",
      "canonical_id": null,
      "canonical_label": null,
      "domain": "Other",
      "action": "OTHER",
      "obligation_type": "Other",
      "mandatory_flag": "Not Applicable",
      "match_type": "unmapped",
      "match_confidence": 0.0,
      "review_required": true,
      "suggested_canonical_id": null,
      "suggested_label": null,
      "suggestion_confidence": null
    },
    {
      "clause_id": "clause_4",
      "clause_no": "4",
      "source_concept": "Legal reference",
      "canonical_id": null,
      "canonical_label": null,
      "domain": "Other",
      "action": "OTHER",
      "obligation_type": "Other",
      "mandatory_flag": "Not Applicable",
      "match_type": "unmapped",
      "match_confidence": 0.0,
      "review_required": true,
      "suggested_canonical_id": null,
      "suggested_label": null,
      "suggestion_confidence": null
    },
    {
      "clause_id": "clause_9__2",
      "clause_no": "9",
      "source_concept": "Associated entity definition",
      "canonical_id": null,
      "canonical_label": null,
      "domain": "Banking Regulation & Supervision",
      "action": "OTHER",
      "obligation_type": "Other",
      "mandatory_flag": "Not Applicable",
      "match_type": "unmapped",
      "match_confidence": 0.0,
      "review_required": true,
      "suggested_canonical_id": null,
      "suggested_label": null,
      "suggestion_confidence": null
    },
    {
      "clause_id": "clause_15",
      "clause_no": "15",
      "source_concept": "Subsidiary definition",
      "canonical_id": "CPT_DEFAULT_DEFINITION",
      "canonical_label": "Definition of Default",
      "domain": "Banking Regulation & Supervision",
      "action": "OTHER",
      "obligation_type": "Other",
      "mandatory_flag": "Not Applicable",
      "match_type": "fuzzy",
      "match_confidence": 0.507,
      "review_required": true,
      "suggested_canonical_id": null,
      "suggested_label": null,
      "suggestion_confidence": null
    },
    {
      "clause_id": "clause_1__3",
      "clause_no": "1",
      "source_concept": "Sharia compliance requirement",
      "canonical_id": null,
      "canonical_label": null,
      "domain": "Other",
      "action": "OTHER",
      "obligation_type": "Other",
      "mandatory_flag": "Not Applicable",
      "match_type": "unmapped",
      "match_confidence": 0.0,
      "review_required": true,
      "suggested_canonical_id": null,
      "suggested_label": null,
      "suggestion_confidence": null
    },
    {
      "clause_id": "clause_1__4",
      "clause_no": "1",
      "source_concept": "Regulation interpretation power",
      "canonical_id": "CPT_DOCUMENT_META",
      "canonical_label": "Document Metadata",
      "domain": "Banking Regulation & Supervision",
      "action": "OTHER",
      "obligation_type": "Other",
      "mandatory_flag": "Not Applicable",
      "match_type": "fuzzy",
      "match_confidence": 0.586,
      "review_required": true,
      "suggested_canonical_id": null,
      "suggested_label": null,
      "suggestion_confidence": null
    },
    {
      "clause_id": "clause_1__5",
      "clause_no": "1",
      "source_concept": "Previous regulation cancellation",
      "canonical_id": null,
      "canonical_label": null,
      "domain": "Other",
      "action": "OTHER",
      "obligation_type": "Other",
      "mandatory_flag": "Not Applicable",
      "match_type": "unmapped",
      "match_confidence": 0.0,
      "review_required": true,
      "suggested_canonical_id": null,
      "suggested_label": null,
      "suggestion_confidence": null
    },
    {
      "clause_id": "clause_1__6",
      "clause_no": "1",
      "source_concept": "Standard publication requirement",
      "canonical_id": null,
      "canonical_label": null,
      "domain": "Other",
      "action": "IMPLEMENT",
      "obligation_type": "Other",
      "mandatory_flag": "Mandatory",
      "match_type": "unmapped",
      "match_confidence": 0.0,
      "review_required": true,
      "suggested_canonical_id": null,
      "suggested_label": null,
      "suggestion_confidence": null
    }
  ]
}